{
  "schema_version": "0.6",
  "candidate_id": "44444444-4444-4444-8444-444444444444",
  "circulation_refs": [
    "55555555-5555-4555-8555-555555555555"
  ],
  "classification": "vortex_candidate",
  "method": "multi_signal_vortex_candidate_v1",
  "window_start": "2026-10-04T06:20:00+09:00",
  "window_end": "2026-10-04T06:25:00+09:00",
  "candidate_state": "provisional",
  "confidence": 0.76,
  "weights": {
    "cycle_count": 0.25,
    "return_count": 0.25,
    "cycle_density": 0.25,
    "circulation_strength": 0.25
  },
  "score": 0.69,
  "signals": {
    "cycle_count": 0.8,
    "return_count": 0.75,
    "cycle_density": 0.62,
    "circulation_strength": 0.59,
    "persistence_count": 4,
    "persistence_duration_seconds": 1200
  },
  "core_regions": [
    "agent-a",
    "agent-b",
    "agent-c"
  ],
  "persistence": {
    "count": 4,
    "duration_seconds": 1200,
    "state": "strengthened"
  },
  "provenance": {
    "generated_at": "2026-10-04T06:25:02+09:00",
    "analyzer_id": "vortex-analyzer-01",
    "source_circulation_refs": [
      "55555555-5555-4555-8555-555555555555"
    ],
    "source_digest": "aaaaaaaaaaaaaaaaaaaaaaaaaaaaaaaaaaaaaaaaaaaaaaaaaaaaaaaaaaaaaaaa"
  }
}
